{
  "$schema": "../../schema/assessment-bank.schema.json",
  "format": "assessment-bank",
  "schemaVersion": "1.0.0",
  "id": "bank.pf.state.values-types.v1",
  "courseId": "programming-foundations",
  "courseVersion": "0.1.0",
  "moduleId": "pf.state",
  "skillId": "pf.state.values-types",
  "title": "Values and types deterministic misconception check",
  "publication": {
    "stage": "draft",
    "author": {
      "id": "codex-assisted-draft",
      "displayName": "Codex-assisted curriculum tranche",
      "kind": "ai-assisted"
    },
    "authoredAt": "2026-07-12T06:30:00.000Z",
    "aiAssisted": true,
    "reviewer": null,
    "changeSummary": "Deterministic misconception item for Values and types; blocked from formal exams until independent human review."
  },
  "sourceRefs": [
    "cs2023-sdf"
  ],
  "items": [
    {
      "id": "pf.state.values-types.mcq.misconception",
      "skillId": "pf.state.values-types",
      "title": "Values and types: correct the failure model",
      "kind": "mcq",
      "prompt": "Which statement correctly resolves this documented beginner mistake? Values that look similar on screen always support the same operations, so text 12 and number 12 are interchangeable.",
      "points": 4,
      "evidenceLevel": "interpret",
      "examEligibility": {
        "eligible": false,
        "rationale": "The deterministic answer and rubric are AI-assisted draft content awaiting independent human approval."
      },
      "hints": [
        "Compare both options with the canonical model, declared boundary, and observable evidence in the lesson."
      ],
      "feedback": {
        "correct": "Correct. Choose and validate a type from the intended operations; convert representations explicitly when moving between text, numbers, truth values, and collections.",
        "incorrect": "The selected statement preserves the documented misconception. Choose and validate a type from the intended operations; convert representations explicitly when moving between text, numbers, truth values, and collections."
      },
      "rubric": {
        "passPoints": 4,
        "criteria": [
          {
            "id": "correct-model",
            "description": "Selects the source-aligned correction for Values and types instead of the documented misconception.",
            "points": 4,
            "critical": true
          }
        ]
      },
      "privateAuthorNotes": [
        "Human reviewer must verify the correction against the cited source and ensure the misconception option is plausible without reinforcing it."
      ],
      "options": [
        {
          "id": "correct-model",
          "text": "Choose and validate a type from the intended operations; convert representations explicitly when moving between text, numbers, truth values, and collections."
        },
        {
          "id": "documented-misconception",
          "text": "Values that look similar on screen always support the same operations, so text 12 and number 12 are interchangeable."
        }
      ],
      "answer": {
        "correctOptionIds": [
          "correct-model"
        ],
        "explanation": "Choose and validate a type from the intended operations; convert representations explicitly when moving between text, numbers, truth values, and collections."
      }
    }
  ]
}
