{
  "$schema": "../../schema/assessment-bank.schema.json",
  "format": "assessment-bank",
  "schemaVersion": "1.0.0",
  "id": "bank.pf.computing.execution.v1",
  "courseId": "programming-foundations",
  "courseVersion": "0.1.0",
  "moduleId": "pf.computing",
  "skillId": "pf.computing.execution",
  "title": "Source-to-execution models deterministic misconception check",
  "publication": {
    "stage": "draft",
    "author": {
      "id": "codex-assisted-draft",
      "displayName": "Codex-assisted curriculum tranche",
      "kind": "ai-assisted"
    },
    "authoredAt": "2026-07-12T06:30:00.000Z",
    "aiAssisted": true,
    "reviewer": null,
    "changeSummary": "Deterministic misconception item for Source-to-execution models; blocked from formal exams until independent human review."
  },
  "sourceRefs": [
    "cs2023-sdf"
  ],
  "items": [
    {
      "id": "pf.computing.execution.mcq.misconception",
      "skillId": "pf.computing.execution",
      "title": "Source-to-execution models: correct the failure model",
      "kind": "mcq",
      "prompt": "Which statement correctly resolves this documented beginner mistake? Compiled languages run directly from source while interpreted languages never translate any code.",
      "points": 4,
      "evidenceLevel": "interpret",
      "examEligibility": {
        "eligible": false,
        "rationale": "The deterministic answer and rubric are AI-assisted draft content awaiting independent human approval."
      },
      "hints": [
        "Compare both options with the canonical model, declared boundary, and observable evidence in the lesson."
      ],
      "feedback": {
        "correct": "Correct. Execution must name the concrete implementation and stages; source is represented or translated before a processor carries out machine instructions, and runtimes can mix strategies.",
        "incorrect": "The selected statement preserves the documented misconception. Execution must name the concrete implementation and stages; source is represented or translated before a processor carries out machine instructions, and runtimes can mix strategies."
      },
      "rubric": {
        "passPoints": 4,
        "criteria": [
          {
            "id": "correct-model",
            "description": "Selects the source-aligned correction for Source-to-execution models instead of the documented misconception.",
            "points": 4,
            "critical": true
          }
        ]
      },
      "privateAuthorNotes": [
        "Human reviewer must verify the correction against the cited source and ensure the misconception option is plausible without reinforcing it."
      ],
      "options": [
        {
          "id": "correct-model",
          "text": "Execution must name the concrete implementation and stages; source is represented or translated before a processor carries out machine instructions, and runtimes can mix strategies."
        },
        {
          "id": "documented-misconception",
          "text": "Compiled languages run directly from source while interpreted languages never translate any code."
        }
      ],
      "answer": {
        "correctOptionIds": [
          "correct-model"
        ],
        "explanation": "Execution must name the concrete implementation and stages; source is represented or translated before a processor carries out machine instructions, and runtimes can mix strategies."
      }
    }
  ]
}
