{
  "$schema": "../../schema/assessment-bank.schema.json",
  "format": "assessment-bank",
  "schemaVersion": "1.0.0",
  "id": "bank.pf.data.records.v1",
  "courseId": "programming-foundations",
  "courseVersion": "0.1.0",
  "moduleId": "pf.data",
  "skillId": "pf.data.records",
  "title": "Records and entities deterministic misconception check",
  "publication": {
    "stage": "draft",
    "author": {
      "id": "codex-assisted-draft",
      "displayName": "Codex-assisted curriculum tranche",
      "kind": "ai-assisted"
    },
    "authoredAt": "2026-07-12T06:30:00.000Z",
    "aiAssisted": true,
    "reviewer": null,
    "changeSummary": "Deterministic misconception item for Records and entities; blocked from formal exams until independent human review."
  },
  "sourceRefs": [
    "cs2023-sdf"
  ],
  "items": [
    {
      "id": "pf.data.records.mcq.misconception",
      "skillId": "pf.data.records",
      "title": "Records and entities: correct the failure model",
      "kind": "mcq",
      "prompt": "Which statement correctly resolves this documented beginner mistake? Any values frequently used together should be copied into one record, including every derived and unrelated field.",
      "points": 4,
      "evidenceLevel": "interpret",
      "examEligibility": {
        "eligible": false,
        "rationale": "The deterministic answer and rubric are AI-assisted draft content awaiting independent human approval."
      },
      "hints": [
        "Compare both options with the canonical model, declared boundary, and observable evidence in the lesson."
      ],
      "feedback": {
        "correct": "Correct. Group cohesive facts about one entity, name their meanings and constraints, and derive redundant values rather than storing conflicting copies when possible.",
        "incorrect": "The selected statement preserves the documented misconception. Group cohesive facts about one entity, name their meanings and constraints, and derive redundant values rather than storing conflicting copies when possible."
      },
      "rubric": {
        "passPoints": 4,
        "criteria": [
          {
            "id": "correct-model",
            "description": "Selects the source-aligned correction for Records and entities instead of the documented misconception.",
            "points": 4,
            "critical": true
          }
        ]
      },
      "privateAuthorNotes": [
        "Human reviewer must verify the correction against the cited source and ensure the misconception option is plausible without reinforcing it."
      ],
      "options": [
        {
          "id": "correct-model",
          "text": "Group cohesive facts about one entity, name their meanings and constraints, and derive redundant values rather than storing conflicting copies when possible."
        },
        {
          "id": "documented-misconception",
          "text": "Any values frequently used together should be copied into one record, including every derived and unrelated field."
        }
      ],
      "answer": {
        "correctOptionIds": [
          "correct-model"
        ],
        "explanation": "Group cohesive facts about one entity, name their meanings and constraints, and derive redundant values rather than storing conflicting copies when possible."
      }
    }
  ]
}
