{
  "$schema": "../../schema/assessment-bank.schema.json",
  "format": "assessment-bank",
  "schemaVersion": "1.0.0",
  "id": "bank.cpp.functions.contracts.v1",
  "courseId": "cpp",
  "courseVersion": "0.1.0",
  "moduleId": "cpp.functions",
  "skillId": "cpp.functions.contracts",
  "title": "Function contracts and return values deterministic evidence bank",
  "publication": {
    "stage": "draft",
    "author": {
      "id": "codex-assisted-draft",
      "displayName": "Codex-assisted C and C++ tranche",
      "kind": "ai-assisted"
    },
    "authoredAt": "2026-07-12T08:00:00.000Z",
    "aiAssisted": true,
    "reviewer": null,
    "changeSummary": "Added digest-pinned deterministic executable evidence for Function contracts and return values; AI-assisted draft remains human-unreviewed and exam-ineligible."
  },
  "sourceRefs": [
    "cpp-core",
    "cs2023-sdf"
  ],
  "items": [
    {
      "skillId": "cpp.functions.contracts",
      "kind": "mcq",
      "points": 4,
      "examEligibility": {
        "eligible": false,
        "rationale": "AI-assisted deterministic draft awaiting independent human standards and assessment review."
      },
      "privateAuthorNotes": [
        "A human reviewer must verify language-version accuracy, distractor validity, equivalence, and grading evidence before formal use."
      ],
      "id": "cpp.functions.contracts.mcq.misconception",
      "title": "Function contracts and return values: reject the invalid rule",
      "prompt": "Which statement correctly resolves this CPP misconception? If parameter and return types compile, all valid domain inputs and failure behavior are already defined by the signature.",
      "evidenceLevel": "interpret",
      "hints": [
        "Compare each option with the exact language rule, standard boundary, and observable evidence in the authored draft."
      ],
      "feedback": {
        "correct": "Correct. Document and test semantic preconditions, ownership, effects, errors, and guarantees in addition to the C++ type signature.",
        "incorrect": "That option preserves the documented misconception. Document and test semantic preconditions, ownership, effects, errors, and guarantees in addition to the C++ type signature."
      },
      "rubric": {
        "passPoints": 4,
        "criteria": [
          {
            "id": "language-rule",
            "description": "Selects the source-aligned CPP correction instead of the documented misconception.",
            "points": 4,
            "critical": true
          }
        ]
      },
      "options": [
        {
          "id": "correct-rule",
          "text": "Document and test semantic preconditions, ownership, effects, errors, and guarantees in addition to the C++ type signature."
        },
        {
          "id": "documented-misconception",
          "text": "If parameter and return types compile, all valid domain inputs and failure behavior are already defined by the signature."
        }
      ],
      "answer": {
        "correctOptionIds": [
          "correct-rule"
        ],
        "explanation": "Document and test semantic preconditions, ownership, effects, errors, and guarantees in addition to the C++ type signature."
      }
    },
    {
      "skillId": "cpp.functions.contracts",
      "kind": "fill-gap",
      "points": 4,
      "examEligibility": {
        "eligible": false,
        "rationale": "AI-assisted deterministic draft awaiting independent human standards and assessment review."
      },
      "privateAuthorNotes": [
        "A human reviewer must verify language-version accuracy, distractor validity, equivalence, and grading evidence before formal use."
      ],
      "id": "cpp.functions.contracts.fill.checkpoint",
      "title": "Function contracts and return values: complete the language rule",
      "prompt": "Complete the missing CPP checkpoint in the source-aligned correction. Use the exact token or phrase required by this draft.",
      "evidenceLevel": "recall",
      "hints": [
        "Use the checkpoint that distinguishes the valid rule from this misconception: If parameter and return types compile, all valid domain inputs and failure behavior are already defined by the signature."
      ],
      "feedback": {
        "correct": "Correct. The required checkpoint is 'semantic preconditions'.",
        "incorrect": "Recheck the exact language rule and its boundary. Document and test semantic preconditions, ownership, effects, errors, and guarantees in addition to the C++ type signature."
      },
      "rubric": {
        "passPoints": 4,
        "criteria": [
          {
            "id": "exact-checkpoint",
            "description": "Supplies the exact CPP token or phrase that completes the reviewed rule candidate.",
            "points": 4,
            "critical": true
          }
        ]
      },
      "template": "Document and test {{key-rule}}, ownership, effects, errors, and guarantees in addition to the C++ type signature.",
      "gaps": [
        {
          "id": "key-rule",
          "label": "Missing language checkpoint"
        }
      ],
      "answer": {
        "acceptedByGap": {
          "key-rule": [
            "semantic preconditions"
          ]
        },
        "caseSensitive": true,
        "explanation": "Document and test semantic preconditions, ownership, effects, errors, and guarantees in addition to the C++ type signature."
      }
    },
    {
      "id": "cpp.functions.contracts.code.apply",
      "skillId": "cpp.functions.contracts",
      "title": "Function contracts and return values: executable application",
      "kind": "code",
      "prompt": "Implement safe_square with the documented input contract -1000000 through 1000000, returning std::optional<long long>; print the square or invalid.",
      "points": 10,
      "evidenceLevel": "apply",
      "examEligibility": {
        "eligible": false,
        "rationale": "AI-assisted deterministic draft awaiting independent human standards, security, and assessment review."
      },
      "hints": [
        "Begin with the declared input and exact output contract, then implement the named language facet without relying on undefined behavior."
      ],
      "feedback": {
        "correct": "The reference-aligned visible and hidden deterministic checks passed in the pinned isolated runtime.",
        "incorrect": "At least one deterministic check failed; inspect input validation, boundary behavior, and the named language rule without exposing hidden cases."
      },
      "rubric": {
        "passPoints": 10,
        "criteria": [
          {
            "id": "deterministic-behavior",
            "description": "Compiles in the pinned runtime and passes every visible and hidden exact-output case.",
            "points": 7,
            "critical": true
          },
          {
            "id": "language-facet",
            "description": "Uses the target C or C++ language facet with declared bounds and without an out-of-scope workaround.",
            "points": 3,
            "critical": true
          }
        ]
      },
      "privateAuthorNotes": [
        "AI-assisted and human-unreviewed: formal exam eligibility is prohibited until independent technical and assessment approval.",
        "Reference verification uses the digest-pinned local container with network=none, no package installation, a read-only source mount, and deterministic stdin/stdout.",
        "Executable facet: explicit precondition validation and optional result"
      ],
      "starterCode": "#include <iostream>\n#include <optional>\n\nstd::optional<long long> safe_square(long long value) {\n    // enforce the contract before multiplication\n}\n\nint main() {\n    // read, call, inspect optional\n}\n",
      "runtime": {
        "engine": "isolated-runner",
        "language": "cpp",
        "version": "C++20 / G++ 14.2.0",
        "imageDigest": "sha256:29330bf1dfe1a154b46dd6a4e4ebb2d0690515e55cd1e2755d5ec845b92ff47a",
        "entrypoint": "main.cpp",
        "timeLimitMs": 2000,
        "memoryLimitMb": 128
      },
      "tests": [
        {
          "id": "cpp-functions-contracts-case-1",
          "visibility": "visible",
          "category": "normal",
          "stdin": "12\n",
          "expectedStdout": "144\n",
          "comparison": "exact",
          "critical": true
        },
        {
          "id": "cpp-functions-contracts-case-2",
          "visibility": "hidden",
          "category": "boundary",
          "stdin": "0\n",
          "expectedStdout": "0\n",
          "comparison": "exact",
          "critical": true
        },
        {
          "id": "cpp-functions-contracts-case-3",
          "visibility": "hidden",
          "category": "invalid",
          "stdin": "1000001\n",
          "expectedStdout": "invalid\n",
          "comparison": "exact",
          "critical": true
        }
      ],
      "answer": {
        "referenceSolution": "#include <iostream>\n#include <optional>\n\nstd::optional<long long> safe_square(long long value) {\n    if (value < -1000000 || value > 1000000) return std::nullopt;\n    return value * value;\n}\n\nint main() {\n    long long value{};\n    if (!(std::cin >> value)) return 1;\n    if (auto result = safe_square(value)) std::cout << *result << '\\n';\n    else std::cout << \"invalid\\n\";\n}\n",
        "explanation": "The reference solution exercises explicit precondition validation and optional result under the bounded deterministic contract; it remains an AI-assisted draft pending human review."
      }
    }
  ]
}
